{"attendance_summary":{"calculation_source":"stored_statistics","expected_people":90,"full_day_leave_people":[{"name":"周菁","person_id":"p003","review_reason":null,"source_record_id":"leave-003","work_period_status":"not_applicable"},{"name":"陈苏","person_id":"p004","review_reason":null,"source_record_id":"leave-004","work_period_status":"not_applicable"},{"name":"刘茜","person_id":"p005","review_reason":null,"source_record_id":"leave-005","work_period_status":"not_applicable"},{"name":"杨瑞","person_id":"p006","review_reason":null,"source_record_id":"leave-006","work_period_status":"not_applicable"},{"name":"王海娜","person_id":"p007","review_reason":null,"source_record_id":"leave-007","work_period_status":"not_applicable"}],"half_day_leave_people":[],"leave_people":5,"missing_people":[{"name":"王达伟","person_id":"p001","review_reason":null,"source_record_id":null,"work_period_status":"missing"},{"name":"吴鹏","person_id":"p002","review_reason":null,"source_record_id":null,"work_period_status":"missing"}],"missing_people_count":2,"review_required_people":[],"submitted_by_1730_people":88,"submitted_by_1730_rate":0.9777777777777777,"submitted_by_2200_people":88,"submitted_by_2200_rate":0.9777777777777777},"collaborations":[{"evidence_id":"snapshot-report-p008","parent_task_id":null,"person_id":"p008","related_task_id":null,"relation_type":"lead","role":"lead","task_id":"task-001"},{"evidence_id":"snapshot-report-p009","parent_task_id":null,"person_id":"p009","related_task_id":null,"relation_type":"collaborate","role":"collaborator","task_id":"task-002"},{"evidence_id":"snapshot-report-p010","parent_task_id":null,"person_id":"p010","related_task_id":null,"relation_type":"collaborate","role":"collaborator","task_id":"task-003"},{"evidence_id":"snapshot-report-p011","parent_task_id":null,"person_id":"p011","related_task_id":null,"relation_type":"collaborate","role":"collaborator","task_id":"task-004"},{"evidence_id":"snapshot-report-p012","parent_task_id":null,"person_id":"p012","related_task_id":null,"relation_type":"collaborate","role":"collaborator","task_id":"task-005"},{"evidence_id":"snapshot-report-p013","parent_task_id":null,"person_id":"p013","related_task_id":null,"relation_type":"collaborate","role":"collaborator","task_id":"task-006"},{"evidence_id":"snapshot-report-p014","parent_task_id":null,"person_id":"p014","related_task_id":null,"relation_type":"collaborate","role":"collaborator","task_id":"task-007"},{"evidence_id":"snapshot-report-p015","parent_task_id":null,"person_id":"p015","related_task_id":null,"relation_type":"collaborate","role":"collaborator","task_id":"task-008"},{"evidence_id":"snapshot-report-p016","parent_task_id":null,"person_id":"p016","related_task_id":null,"relation_type":"collaborate","role":"collaborator","task_id":"task-009"},{"evidence_id":"snapshot-report-p017","parent_task_id":null,"person_id":"p017","related_task_id":null,"relation_type":"collaborate","role":"collaborator","task_id":"task-010"},{"evidence_id":"snapshot-report-p018","parent_task_id":null,"person_id":"p018","related_task_id":null,"relation_type":"collaborate","role":"collaborator","task_id":"task-011"},{"evidence_id":"snapshot-report-p019","parent_task_id":null,"person_id":"p019","related_task_id":null,"relation_type":"collaborate","role":"collaborator","task_id":"task-012"},{"evidence_id":"snapshot-report-p020","parent_task_id":null,"person_id":"p020","related_task_id":null,"relation_type":"collaborate","role":"collaborator","task_id":"task-013"},{"evidence_id":"snapshot-report-p021","parent_task_id":null,"person_id":"p021","related_task_id":null,"relation_type":"collaborate","role":"collaborator","task_id":"task-014"},{"evidence_id":"snapshot-report-p022","parent_task_id":null,"person_id":"p022","related_task_id":null,"relation_type":"collaborate","role":"collaborator","task_id":"task-015"},{"evidence_id":"snapshot-report-p023","parent_task_id":null,"person_id":"p023","related_task_id":null,"relation_type":"collaborate","role":"collaborator","task_id":"task-016"},{"evidence_id":"snapshot-report-p024","parent_task_id":null,"person_id":"p024","related_task_id":null,"relation_type":"collaborate","role":"collaborator","task_id":"task-017"},{"evidence_id":"snapshot-report-p025","parent_task_id":null,"person_id":"p025","related_task_id":null,"relation_type":"collaborate","role":"collaborator","task_id":"task-018"},{"evidence_id":"snapshot-report-p026","parent_task_id":null,"person_id":"p026","related_task_id":null,"relation_type":"collaborate","role":"collaborator","task_id":"task-019"},{"evidence_id":"snapshot-report-p027","parent_task_id":null,"person_id":"p027","related_task_id":null,"relation_type":"collaborate","role":"collaborator","task_id":"task-020"},{"evidence_id":"snapshot-report-p028","parent_task_id":null,"person_id":"p028","related_task_id":null,"relation_type":"collaborate","role":"collaborator","task_id":"task-021"},{"evidence_id":"snapshot-report-p029","parent_task_id":null,"person_id":"p029","related_task_id":null,"relation_type":"collaborate","role":"collaborator","task_id":"task-022"},{"evidence_id":"snapshot-report-p030","parent_task_id":null,"person_id":"p030","related_task_id":null,"relation_type":"collaborate","role":"collaborator","task_id":"task-023"},{"evidence_id":"snapshot-report-p031","parent_task_id":null,"person_id":"p031","related_task_id":null,"relation_type":"collaborate","role":"collaborator","task_id":"task-024"},{"evidence_id":"snapshot-report-p032","parent_task_id":null,"person_id":"p032","related_task_id":null,"relation_type":"collaborate","role":"collaborator","task_id":"task-025"},{"evidence_id":"snapshot-report-p033","parent_task_id":null,"person_id":"p033","related_task_id":null,"relation_type":"collaborate","role":"collaborator","task_id":"task-026"},{"evidence_id":"snapshot-report-p034","parent_task_id":null,"person_id":"p034","related_task_id":null,"relation_type":"collaborate","role":"collaborator","task_id":"task-027"},{"evidence_id":"snapshot-report-p035","parent_task_id":null,"person_id":"p035","related_task_id":null,"relation_type":"collaborate","role":"collaborator","task_id":"task-028"},{"evidence_id":"snapshot-report-p036","parent_task_id":null,"person_id":"p036","related_task_id":null,"relation_type":"collaborate","role":"collaborator","task_id":"task-029"},{"evidence_id":"snapshot-report-p037","parent_task_id":null,"person_id":"p037","related_task_id":null,"relation_type":"collaborate","role":"collaborator","task_id":"task-030"},{"evidence_id":"snapshot-report-p038","parent_task_id":null,"person_id":"p038","related_task_id":null,"relation_type":"collaborate","role":"collaborator","task_id":"task-031"},{"evidence_id":"snapshot-report-p039","parent_task_id":null,"person_id":"p039","related_task_id":null,"relation_type":"collaborate","role":"collaborator","task_id":"task-032"},{"evidence_id":"snapshot-report-p040","parent_task_id":null,"person_id":"p040","related_task_id":null,"relation_type":"collaborate","role":"collaborator","task_id":"task-033"},{"evidence_id":"snapshot-report-p041","parent_task_id":null,"person_id":"p041","related_task_id":null,"relation_type":"collaborate","role":"collaborator","task_id":"task-034"},{"evidence_id":"snapshot-report-p042","parent_task_id":null,"person_id":"p042","related_task_id":null,"relation_type":"collaborate","role":"collaborator","task_id":"task-035"},{"evidence_id":"snapshot-report-p043","parent_task_id":null,"person_id":"p043","related_task_id":null,"relation_type":"collaborate","role":"collaborator","task_id":"task-036"},{"evidence_id":"snapshot-report-p044","parent_task_id":null,"person_id":"p044","related_task_id":null,"relation_type":"collaborate","role":"collaborator","task_id":"task-037"},{"evidence_id":"snapshot-report-p045","parent_task_id":null,"person_id":"p045","related_task_id":null,"relation_type":"collaborate","role":"collaborator","task_id":"task-038"},{"evidence_id":"snapshot-report-p046","parent_task_id":null,"person_id":"p046","related_task_id":null,"relation_type":"collaborate","role":"collaborator","task_id":"task-039"},{"evidence_id":"snapshot-report-p047","parent_task_id":null,"person_id":"p047","related_task_id":null,"relation_type":"collaborate","role":"collaborator","task_id":"task-040"},{"evidence_id":"snapshot-report-p048","parent_task_id":null,"person_id":"p048","related_task_id":null,"relation_type":"collaborate","role":"collaborator","task_id":"task-041"},{"evidence_id":"snapshot-report-p049","parent_task_id":null,"person_id":"p049","related_task_id":null,"relation_type":"collaborate","role":"collaborator","task_id":"task-042"},{"evidence_id":"snapshot-report-p050","parent_task_id":null,"person_id":"p050","related_task_id":null,"relation_type":"collaborate","role":"collaborator","task_id":"task-043"},{"evidence_id":"snapshot-report-p051","parent_task_id":null,"person_id":"p051","related_task_id":null,"relation_type":"collaborate","role":"collaborator","task_id":"task-044"},{"evidence_id":"snapshot-report-p052","parent_task_id":null,"person_id":"p052","related_task_id":null,"relation_type":"collaborate","role":"collaborator","task_id":"task-045"},{"evidence_id":"snapshot-report-p053","parent_task_id":null,"person_id":"p053","related_task_id":null,"relation_type":"collaborate","role":"collaborator","task_id":"task-046"},{"evidence_id":"snapshot-report-p054","parent_task_id":null,"person_id":"p054","related_task_id":null,"relation_type":"collaborate","role":"collaborator","task_id":"task-047"},{"evidence_id":"snapshot-report-p055","parent_task_id":null,"person_id":"p055","related_task_id":null,"relation_type":"collaborate","role":"collaborator","task_id":"task-048"},{"evidence_id":"snapshot-report-p056","parent_task_id":null,"person_id":"p056","related_task_id":null,"relation_type":"collaborate","role":"collaborator","task_id":"task-049"},{"evidence_id":"snapshot-report-p057","parent_task_id":null,"person_id":"p057","related_task_id":null,"relation_type":"collaborate","role":"collaborator","task_id